{
  "action_type": "create",
  "target": "aws_s3_bucket.logs",
  "parameters": {
    "resource_type": "aws_s3_bucket",
    "properties": {
      "bucket": "my-logs-bucket",
      "acl": "private"
    },
    "tags": {
      "owner": "team-platform",
      "environment": "production",
      "project": "sanmon"
    }
  },
  "context": {
    "authenticated": true,
    "session_id": "sess-abc-iac",
    "domain": "iac"
  },
  "metadata": {
    "timestamp": "2026-03-01T13:01:00Z",
    "agent_id": "agent-004",
    "request_id": "req-031"
  }
}
